{
  "artifact_hashes": [
    "05ca194bdfb8a966bf73bbdb7814a199cedcf0a3d340de315c284bba9a6fa324",
    "504696a3651341293cfec3515d7d7be06c28a2563a9faf76a757dde54b32f945",
    "a4221850c017ddd2b553a11a57cb5ce75ba4d4b62fa5d8b4e8b7e0038babe033",
    "a736860e1d93f10d57212eeba2ef39f953afed1594eef00303caf57f95b1ef1c",
    "dc212c9040c17cf315fa3fdd98d453ad591f2a36bd03e94ec1f50b94f74aca02"
  ],
  "attestation": "I, the human reviewer/user, reviewed the PACKAGE.md evidence for MST0-08U (theorem doc, Layer-A proof, Layer-B formal proof, attack/scan evidence, mutants, run records) and judge it ACCEPT-quality. This verdict was supplied by me, not inferred or generated by the coding agent.",
  "node": "MST0-08U",
  "package_hash": "504696a3651341293cfec3515d7d7be06c28a2563a9faf76a757dde54b32f945",
  "reviewer_id": "human-reviewer-user",
  "schema_version": "1.0",
  "verdict": "ACCEPT"
}
