{
  "artifact_hashes": [
    "3d6068c2d47c5a49835efae0c7d7f28952c17b3097da26a12df1a6b239e13aaf",
    "4edcae7c9b94a37e0fc2162822c3855e0d13891e90ff642897121a60dc89977b",
    "63a072d18b55ed5009b9a46d2f25c2a9293e3a1c73079c788126253bcfc6f330",
    "713eb181818007ca515a3bb3f0a6d2fd5b0d075a8d96244847c3125655e3f2f3",
    "b85c7433899fb804aa92d108e30f4722e4e46882be8998dc61baa9adbe1b0142"
  ],
  "attestation": "I, the human reviewer/user, reviewed the PACKAGE.md evidence for MST0-22 (theorem doc, Layer-A proof, Layer-B formal proof, attack/scan evidence, mutants, run records) and judge it ACCEPT-quality. This verdict was supplied by me, not inferred or generated by the coding agent.",
  "node": "MST0-22",
  "package_hash": "4edcae7c9b94a37e0fc2162822c3855e0d13891e90ff642897121a60dc89977b",
  "reviewer_id": "human-reviewer-user",
  "schema_version": "1.0",
  "verdict": "ACCEPT"
}
